path,type,source,altText,functionBot,sensationBot,rationaleBot,associationBot,feelingBot
\images\Lobster.jpg,Product,Pinterest,hCL kVc L4E MIw N7A XiG,This is a toothbrush holder that is sticked to the wall. It would offer practical storage for toothbrushes and other small bathroom items with its grippers,"This is a lobster-shaped toothbrush holder cradling two toothbrushes.It has a smooth, translucent body that is colored in red, and its claws are bendable.","This is a lobster toothbrush holder, a surreal fusion of organic marine form and utilitarian function, embodying both the grotesque and the whimsical. ","This lobster toothbrush holder echoes Dalí's ""Lobster Telephone"" and Koons'sculptures, such as his oversized balloon animals and his stainless-steel Lobster (2003).",This lobster design is so quirky and playful! I would gladly use it as my toothbrush holder. It has brightened my day.
\images\hamburgerTableware.jpg,Product,Walmart,50% off Clear! Originality Ceramic Tableware Gifts Household Dinner Tray Sum Tray Hamburger Tableware,"This is a tableware set that mimics a hamburger. It is designed in stackable layers, where each component corresponds to a specific dining function.","Running one’s fingers over the curved surface of this tableware, there is a glossy, uninterrupted glide, much like ceramic plates or high-quality plastic.","The hamburger tableware exists in a liminal state between utility and illusion—it is both a meal and not a meal, both a vessel and an object of desire. It challenges Aristotelian substance and form.","The bold, exaggerated hamburger form of this tableware reflects Pop Art’s fascination with consumer culture, much like Claes Oldenburg’s oversized soft sculptures of food items",This hamburger tableware evokes feelings that blend the familiar with the uncanny.Playful and fun!
\images\watermelonPlush.jpg,Product,Walmart,rourlinge Silent Watermelon Strip Happy Watermelon Plush Toy Doll Home Throw Pillow Girl Gift halloween gifts gifts for women gifts for men,"This is a watermelon plushy, a soft, huggable object, primarily for comfort and decoration.","This plushy's squishiness enhances its tactile satisfaction, similar to stress balls or memory foam.","This plushy imitates a watermelon but is not a watermelon, echoing Baudrillard's simulacra—a copy that detaches from reality.","Similar to Andy Warhol's Campbell's Soup Cans, the plushy turns an everyday item into an icon of exaggerated consumer culture.",Is this plushy designed based on a meme? Look at it's speechless face!
\images\monsterAmplifier.jpg,Product,Uncommon Goods,Little Monster Phone Amplifier,"This Monster Amplifier is a powerful sound system, designed to enhance audio output. Its compact, rounded shape makes it easy to place anywhere.","Covered in a smooth, matte silicone or velvety soft plush, the amplifier is designed to be pleasant to the touch. The bass is deep yet gentle, like a purring creature.","The amplifier represents the harmony between technology and comfort, showing that power doesn't always have to be intimidating.","Similar to Totoro or other round, soft creatures, this amplifier gives off whimsical, comforting energy.",Feels like a little friend that fills the space with sound.
\images\sassyCanister.jpg,Product,Uncommon Goods,Sassy Storage Canister,"This canister serves as a storage container, designed to store various items such as food, household supplies, or even personal accessories.","The smooth ceramic finish of the canister feels soft to the touch. The sleek, gray or white base gives it a clean, minimalist look.",The canister's sassy design presents a juxtaposition of utility and personality. It spices up the space by adding a touch of unexpected whimsy to a functional object.,"The clean, simple color scheme and shapes are reminiscent of mid-century modern design, but the slightly quirky and cheerful design of the canister aligns with the Kawaii aesthetic.","The sassy shape and blue dot accents immediately create a lighthearted, joyful feeling when seen or used."
\images\steamlessWineGlasses.jpg,Product,Uncommon Goods,Stemless Aerating Wine Glasses - Set of 2,"These glasses often feature double-wall construction that traps air between the inner and outer walls, maintaining the wine’s temperature while keeping the exterior dry to the touch.",The polished finish of the glass allows for a pleasurable tactile experience. The insulated double-wall design means the glass is comfortable to hold without the worry of cold condensation or warmth transfer.,"These steamless wine glasses represent a modern rethinking of tradition, stripping away unnecessary features like stems to create a more efficient and straightforward vessel.",These double-walled design could draw comparisons to modern glass art pieces that blend both artistry and utility.,The clever double-layered design gives the feeling of effortless cleanliness. Satisfying to watch.
\images\facelessMask.jpg,Product,Amazon,61-os2LZvmL._AC_SX679_,"This faceless mask serves as a tool for concealment and anonymity. It can be used in performances, artistic expressions, or rituals, where it acts as a symbol of neutrality or the lack of specific identity.","The absence of facial features adds an element of smoothness where this mask might feel like a blank canvas, giving off an otherworldly or unnatural sensation upon touch.","The faceless mask represents the concept of removing individuality and reducing the wearer to an abstract presence, highlighting the tension between identity and anonymity.","This faceless mask represents the concept of removing individuality and reducing the wearer to an abstract presence, highlighting the tension between identity and anonymity.","I feel disturbed looking at this mask. Where the eyes and mouth are supposed to be are just three small, black rounded holes..."
\images\cherryBrush.jpg,Product,Amazon,Generic Creative Toilet Brush with Holder Bowl&amp;Long Handle Cherry Shaped Toilet Brush Holder Bathroom Cleaning Tool Storage (Hot Pink),This cherry toilet brush is designed to serve the functional need of maintaining a clean and hygienic toilet.,"The handle, in the shape of a cherry, would likely have a smooth, glossy texture, resembling other bathroom accessories.The bristles of the brush, on the other hand, would be firm yet flexible.","The cherry shape of this brush represents the natural world, a symbol of freshness, sweetness, and growth.","This cherry toilet brush could easily be associated with Pop Art, a movement that emphasized bold, everyday objects transformed into high art. ","Watching this cherry brush, I feel happiness, nostalgia, and youthfulness!"
\images\lollipopper.jpg,Product,Amazon,"PLAYABLE ART Lollipopter (Large, Mango Fandango, Gift Box with White Base)",This lollipop shaped toy with layers of spinning fans serves as both a novelty candy item and an interactive toy. ,"With the movement of the spinning fans, this toy draws attention and encourages users to shake its holder.","Much like the brief pleasure derived from the sugary lollipop, the fun of the spinning fans is also temporary.This highlights the transitory nature of joy: fun and indulgence but impactful while they last.","The spinning fans on the lollipopper toy can be compared to kinetic art, where movement becomes an integral part of the artwork. Much like Alexander Calder's mobiles or the whimsical creations of Jean Tinguely.",The novelty of seeing the fans spin when the toy is moved offers a moment of surprise and delight.
\images\treeMan.jpg,Product,Amazon,Tree Man by Hieronymus Bosch from Garden of Earthly Delights,"It's a sculpture of a tree trunk that morphs into a man. The man is looking at his butt, which is a hollow trunk. There's a desolate landscape with animals and whimsical elements within the trunk.","The visual elements of this sculpture are intricate and detailed, showcasing the mystical transformation from human to plant.Its resin texture feels like a smooth, hard plastic.",The Tree Man sculpture embodies the constant struggle between human desires and nature’s cyclical processes—a theme central to Bosch’s work.,"This tree man sculpture was taken from one of Bosch's paintings. Bosch's work, though part of the Northern Renaissance, was deeply rooted in symbolism.","Though it looks weird, this sculpture gives me a religious feeling, like some divine being."
\images\bananaDuck.jpg,Product,Amazon,"Walbest Plush Toy, White Banana Duck, 70cm27.56&#34; Plushie, Soft Stuffed Animal, Cute Sleeping Pillow, Gift for Girls &amp; Teens",These are banana duck plushies that are designed primarily as a comfort item.They serve as a source of comfort for children or anyone in need of a lighthearted companion.,"These plushy are shaped as a banana but its  edible part are like a duck. They are made from soft, cotton fabric, offering a satisfying tactile experience. ",The banana duck plushy might symbolize the unexpected combination of opposites. It blends familiarity with absurdity.,"The banana duck plushy channels the whimsical surrealism, and its unexpected fusion of everyday objects ties it to the Pop Art movement",The quirky form of these plushys might bring me feelings of nostalgia or childhood innocence. I want more of them!
\images\missileBleak.jpg,Photography,Annual Photography Award,None,This is a photography of a missile buried in roccky terrain. It won the annual photography award.,S,R,A,F
\images\deadBird.jpg,Photography,Annual Photography Award,None,This is a black and white photography of a dead bird on the road.It won the annual photography award.,S,R,A,F
\images\boyWithChicken.jpg,Photography,Art.com,"Giclee Print, , large",This is a black and white photography from 1920s of a boy sitting next to a chicken with his legs crossed and a cigarette in his mouth. ,S,R,A,F
\images\subwayStationLight.jpg,Photography,Art.com,"Photographic Print, , large","This is an old black and white photo of the NYC Grand Central subway station, with the sunlight shine through its windows.",S,R,A,F
\images\filmViewers.jpg,Photography,Art.com,"Photographic Print, , large","This is a black and white photo of audience members sport 3-D glasses during the first screening of “Bwana Devil,” the first full-length, color 3-D movie, November 26, 1952.",S,R,A,F
\images\soccerMoment.jpg,Photography,Art.com,"Photographic Print, , large",F,S,R,A,F
\images\monkeyChild.jpg,Photography,Etsy,May include A black and white photo of a child wearing a monkey mask and overalls sitting on a set of steps outside a house.,This is a photo of a child sitting on the doorstep with an ape's head. It serves no purpose at all.,S,R,A,F
\images\rockBillboard.jpg,Photography,My Modern Met,2023 International Photo Awards,This is a photograph of a billboard in a deserted land with a photo of cracked dry land on it.,S,R,A,F
\images\blackHole.jpg,Photography,NASA,The black hole is outlined by emission from hot gas swirling around it,This is the first image of black hole taken by NASA.,S,R,A,F
\images\bearStanding.jpg,Photography,Weibo,None,F,S,R,A,F
\images\lochNessMonster.jpg,Photography,Wikipedia,Loch Ness Monster - Wikipedia,F,S,R,A,F
\images\abstractBluePlant.jpg,Illustration,Behance,None,F,S,R,A,F
\images\caneCigar.jpg,Illustration,Behance,None,F,S,R,A,F
\images\seeThroughDog.jpg,Illustration,Behance,surreal abstract chaos,F,S,R,A,F
\images\chillDude.jpg,Illustration,Etsy,May include Cartoon illustration of a brown dog-like creature wearing a gray sweater and light teal jeans. The creature has a large black nose and is depicted in a standing position with hands in pockets. It,F,S,R,A,F
\images\blackCatDrawing.jpg,Illustration,My Modern Met,Fluffy Black Cat Ink Drawings by Kamwei Fong,F,S,R,A,F
\images\cartoonFrogRun.jpg,Illustration,Pinterest,hCL kVc L4E MIw N7A XiG,F,S,R,A,F
\images\suitManBlueHead.jpg,Illustration,Pinterest,hCL kVc L4E MIw N7A XiG,F,S,R,A,F
\images\rectangleManSilhouette.jpg,Illustration,Pinterest,hCL kVc L4E MIw N7A XiG,F,S,R,A,F
\images\cartoonGunPoint.jpg,Illustration,Pinterest,hCL kVc L4E MIw N7A XiG,F,S,R,A,F
\images\abstractBranches.jpg,Illustration,TATE,None,F,S,R,A,F
\images\bleakVillage.jpg,Illustration,TATE,width-1200_pv5j66x,F,S,R,A,F
\images\fightClubPoster.jpg,Graphic,Amazon,AKAK Fight Club Classic Vintage Movie Aesthetic Poster Decorative Painting Canvas Wall Posters And Art Picture Print Modern Family Bedroom Decor Posters 12x18inch(30x45cm),F,S,R,A,F
\images\sillyWalksPanels.jpg,Graphic,Ebay,Monty Python MINISTRY OF SILLY WALKS John Cleese Comedy Sketch 1970 22x34 POSTER - Picture 1 of 1,F,S,R,A,F
\images\inTheSpringPoster.jpg,Graphic,Etsy,"Constructivism Art, In the Spring Movie Poster by Vladimir and Georgii Stenberg, Mikhail Kaufman Film, Gift for Film Enthusiasts image 1",F,S,R,A,F
\images\largeCapitalManPoster.jpg,Graphic,Poster House,"A lithographic image of a large man taking up almost the entire page. He has orange skin, a white cane, and wears a top hat.",F,S,R,A,F
